ID,Title,Location,dDay,Summary
https://kr.indeed.com/jobs?q=python&vjk=882e071610c0a8cd,ICT 경력사원,성남 분당구,Posted10일 전,"서비스 개발 경험 - 데이터 분석 서비스 개발 관련 툴 활용 경험( Python, R, Java 등) 주요업무 스마트 팩토리 및 스마트 제품/서비스... Database, .NET, Java, Python 등 시스템(SW..."
https://kr.indeed.com/jobs?q=python&vjk=e1f6164f1d03449a,주식회사 데이터스트림즈 기술연구소 Python/Java 개발자,성남 분당구,Posted24일 전,데이터스트림즈 기술연구소 Python/Java 개발자 채용 모집부문 및 자격요건 담당업무 자격요건 우대사항 Python/Java 개발 직군 경력직... 통신·모바일·게임>웹프로그래머> Python|인터넷·IT·통신·모바일·게임...
https://kr.indeed.com/jobs?q=python&vjk=3617e30a1af44426,[NHN SOFT] Back-End 경력 개발자,성남 분당구,Posted오늘,통신·모바일·게임>웹프로그래머> Python|인터넷·IT·통신·모바일·게임... 로그래머>증강현실(AR)|인터넷·IT·통신·모바일·게임>응용프로그래머> Python|인터넷·IT·통신·모바일·게임>응용프로그래머>머신러닝(ML)|인터넷...
https://kr.indeed.com/jobs?q=python&vjk=21d2c5a3f43370e1,[ HDC 랩스 ] 2022년 상반기 경력,성남 분당구,Posted7일 전,인터넷·IT·통신·모바일·게임>웹프로그래머>백엔드|인터넷·IT·통신·모바일·게임>빅데이터·AI(인공지능)> Python|인터넷·IT·통신·모바일·게임>빅데이터·AI(인공지능)>빅데이터|인터넷·IT·통신·모바일·게임>네트워크...
https://kr.indeed.com/jobs?q=python&vjk=e7c8c2b11f24fb43,Software Engineer,서울,Posted30+일 전,"languages, including... limited to: C++, Java, C and Python. Excellent written and verbal communication skills. About..."
https://kr.indeed.com/jobs?q=python&vjk=5ea9ea023c6ccc03,"S/W 엔지니어, 데이터분석 신입/경력 정규직, 인턴",성남 분당구,Posted30+일 전,"케이션 제작 및 유지보수 업무- Python, Golang, QT 중 선택... 2. 시스템프로그래머- Python, Golang, QT 중 선택 가능3. 영상데이터 분석 및 모델링- python기반 영상데이터 분석 및 모델링..."
https://kr.indeed.com/jobs?q=python&vjk=2b9e604e63e7e46d,[카카오커머스] 기술직군,성남 분당구,Posted30+일 전,"우대사항 - 전자금융 감독규정, PCIDSS에 대한 실무 경험이나 이해도가 높으신 분 - JAVA, Python, shell script 등 개발 역량을 갖추신 분 - 웹/앱 취약점 진단 및 모의해킹 역량을 갖추신..."
https://kr.indeed.com/jobs?q=python&vjk=84329a66291839cd,각 부문별,서울 강남구,Posted27일 전,통신·모바일·게임>응용프로그래머> Python|인터넷·IT·통신·모바일·게임... W 엔지니어|인터넷·IT·통신·모바일·게임>빅데이터·AI(인공지능)> Python|유통·물류·운송·운전>유통·상품기획·MD>상품MD|유통·물류·운송...
https://kr.indeed.com/jobs?q=python&vjk=45b22fa764b0dae9,"빅데이터, 인공지능(AI) 외 신입 인턴",서울 종로구,Posted30+일 전,AI(인공지능)>인공지능(AI)|인터넷·IT·통신·모바일·게임>빅데이터·AI(인공지능)>데이터분석|인터넷·IT·통신·모바일·게임>빅데이터·AI(인공지능)> Python|인터넷·IT·통신·모바일·게임>빅데이터·AI(인공지능)>R
https://kr.indeed.com/jobs?q=python&vjk=ca42174fece4f1e7,[HDC 랩스] 2022년 상반기 경력,서울특별시,Posted9일 전,"Spring, node.js, python 프레임워크를 활용한 서버 개발... 전공 무관 ㆍ총경력 : 4년 이상~8년 이하 ㆍ Python 개발 경력 4년 이상 - Python 서버 (Backend) 개발 경력 4년 이상 - 웹..."
https://kr.indeed.com/jobs?q=python&vjk=c7cf3ae03de76f24,[체험형 인턴] 데이터 분석,서울,Posted8일 전,"통계, 컴퓨터공학 등 관련 전공 석사 이상 재학중인 분 - 데이터 분석 관련 인턴 업무를 경험해보신 분 - Python/R 등을 이용한 데이터 분석 업무가 가능하신 분 - 데이터를 통해 비즈니스/일상의 문제를 분석하고 실제로..."
https://kr.indeed.com/jobs?q=python&vjk=c793a3ef3425f495,빅데이터 분석 기술인력 (정규직),서울 강남구,Posted30+일 전,"담당업무]데이터 분석 분야 ( Python, R, SAS 기반의 DATA... BIG DATA 프로젝트 경험자, PL/PM 경력자 우대, R 또는 Python 활용가능한 경력자전공계열: 전산학, 컴퓨터공학, 수학, 응용소프트웨어..."
https://kr.indeed.com/jobs?q=python&vjk=adbd22b4349f9825,2022년도 1차 계약직,대전 유성구,Posted14일 전,"부전공): 전자, 컴퓨터, 멀티미디어, 산업공학 등 이공계열 응용·시스템 SW 프로그래밍(C/C++/C#/ Python 등) 기술 응용·시스템 통합 개발 기술 3D 그래픽 엔진(언리얼/유니티 등) 프로그래밍 기술 석사 이상 2..."
https://kr.indeed.com/jobs?q=python&vjk=e30fe92d72ceb17c,"자율 주행, 로봇 SW 개발자",성남 수정구,Posted30+일 전,"(주)에바 모집부문 및 자격요건 모집부문 담당업무 자격요건 인원 자율주행 SW 엔지니어 Python응용SW [담당업무]ROS 개발, 로봇 주행 알고리즘 개발, SW Optimization[근무부서 및 직급/직책]근무부서: 개발팀..."
https://kr.indeed.com/jobs?q=python&vjk=e8004f38042e7d44,NAVER Cloud 사내 플랫폼 운영,성남 삼평동,Posted20일 전,"Network관련 기초 지식을 보유하고 계신 분 - script ( Python, Html, javascript, Linux shell 중 1개이상... WEB/WAS, DB운영 경험 - Python, JAVA 중 하나의 프로그..."
https://kr.indeed.com/jobs?q=python&vjk=5ea9ea023c6ccc03,"S/W 엔지니어, 데이터분석 신입/경력 정규직, 인턴",성남 분당구,Posted30+일 전,"케이션 제작 및 유지보수 업무- Python, Golang, QT 중 선택... 2. 시스템프로그래머- Python, Golang, QT 중 선택 가능3. 영상데이터 분석 및 모델링- python기반 영상데이터 분석 및 모델링..."
https://kr.indeed.com/jobs?q=python&vjk=5c9f84f18b1b4944,2022 데이터 사이언티스트 부문,서울 강남구,Posted14일 전,인터넷·IT·통신·모바일·게임>ERP·시스템분석·설계>딥러닝|인터넷·IT·통신·모바일·게임>빅데이터·AI(인공지능)>머신러닝|인터넷·IT·통신·모바일·게임>빅데이터·AI(인공지능)> Python
https://kr.indeed.com/jobs?q=python&vjk=35f0a25dee5f3312,딥러닝 알고리즘 및 응용 Engineer,성남 분당구,Posted30+일 전,모바일·게임>빅데이터·AI(인공지능)>인공지능(AI)|인터넷·IT·통신·모바일·게임>빅데이터·AI(인공지능)> Python|인터넷·IT·통신·모바일·게임>빅데이터·AI(인공지능)>머신러닝|인터넷·IT·통신·모바일·게임>빅데이터...
https://kr.indeed.com/jobs?q=python&vjk=91bddba7f7620d51,"[대형증권사] LP/MM 시스템 개발 및 운영,유지보수",서울 강남구,Posted9일 전,레이딩 시스템에 대한 이해 및 열정 보유 <우대사항>C++/JAVA/ Python 프로그래밍 가능 0 명 근무조건 고용형태: 정규직급여조건: 연봉 협의... 통신·모바일·게임>웹프로그래머> Python|인터넷·IT·통신·모바일·게임...
https://kr.indeed.com/jobs?q=python&vjk=3617e30a1af44426,[NHN SOFT] Back-End 경력 개발자,성남 분당구,Posted오늘,통신·모바일·게임>웹프로그래머> Python|인터넷·IT·통신·모바일·게임... 로그래머>증강현실(AR)|인터넷·IT·통신·모바일·게임>응용프로그래머> Python|인터넷·IT·통신·모바일·게임>응용프로그래머>머신러닝(ML)|인터넷...
https://kr.indeed.com/jobs?q=python&vjk=aa20b37148768ec5,Quantitative Researcher,서울,Posted2일 전,etc.) Excellent academic record Proficiency in C/C++ or Python... other programming languages Excellent problem solving...
https://kr.indeed.com/jobs?q=python&vjk=b8ad49577d39559c,웹개발자,경기도 하남,Posted오늘,"jsp, css, html 유경험자-JAVA,SPRING BOOT, AI 인공지능, REST API, PYTHON 경험-AI 이미지 인식 관련 기본 지식 (CNN등) [근무시간 및 형태] 주 5일 근무 (오전) 8시 30분..."
https://kr.indeed.com/jobs?q=python&vjk=3f650de35b95f7fc,Data Scientist,서울,Posted6일 전,"testing, classification, or clustering Experience with Python programming language and writing SQL queries Bachelor’s degree..."
https://kr.indeed.com/jobs?q=python&vjk=cadddc1d517bc19b,Renewable Energy Analyst,서울,Posted6일 전,"other solar energy modeling tools; Experience utilizing Python, R or Matlab (or similar) for statistical analysis and data..."
https://kr.indeed.com/jobs?q=python&vjk=2642a83874ea6bab,"영상처리, 컴퓨터 비전 전문가 (신입/경력)",성남 수정구,Posted30+일 전,"인원 [담당업무] Python, C++, MFC, C를 이용하여 - OpenCV 로 Visual SLAM 개발- MFC, Python을 이용하여 GUI... 통신·모바일·게임>응용프로그래머> Python|인터넷·IT·통신·모바일·게임..."
https://kr.indeed.com/jobs?q=python&vjk=3bceec7af2332b83,Engineer,서울,Posted오늘,"languages, including... limited to: Java, C++, C and Python Understand and explain the core technology and digital..."
https://kr.indeed.com/jobs?q=python&vjk=51df90967b46e8f0,[외국계 스타트업 미소] Business Analyst,서울,Posted30+일 전,통신·모바일·게임>빅데이터·AI(인공지능)>데이터분석|인터넷·IT·통신·모바일·게임>빅데이터·AI(인공지능)> Python|인터넷·IT·통신·모바일·게임>데이터베이스·DBA>MySQL|인터넷·IT·통신·모바일·게임>데이터베이스...
https://kr.indeed.com/jobs?q=python&vjk=69d3cc2cca262747,Machine Learning Engineer Intern - Korea,서울,Posted1일 전,"Strong algorithms and data structure skills. Fluent... least one programming language including Python, Java, and Golang."
https://kr.indeed.com/jobs?q=python&vjk=87309d3ff40ead61,딥러닝 AI 개발 연구원,성남 수정구,Posted30+일 전,시스템프로그래머>임베디드(Embedded)|인터넷·IT·통신·모바일·게임>응용프로그래머>C·C++|인터넷·IT·통신·모바일·게임>응용프로그래머>Linux|인터넷·IT·통신·모바일·게임>빅데이터·AI(인공지능)> Python
https://kr.indeed.com/jobs?q=python&vjk=df21e3bb5d773616,Python Programmer,서울 서초구,Posted30+일 전,개발 – JAVA 프로그래밍(라이브러리 활용) – Spring 프레임 워크 개발 – Python API 프로그래밍 우대사항 – Python 개발 경험 – Open Source 라이브러리 개발경험 – Web 표준에 대한 경험...
https://kr.indeed.com/jobs?q=python&vjk=cb4eca654b2c2901,[TmaxEdu/R&D] 연구 개발자,성남 분당구,Posted10일 전,"CSS, JavaScript, TypeScript [Server 개발(사용 언어)] - Java, Python, SQL [Framework(사용 언어)] - React.js, Spring [입사 지원 시 참고 사항..."
https://kr.indeed.com/jobs?q=python&vjk=b9d4defa6e2b7739,"[TmaxMetaverse/R&D] 게임 엔진, 게임 서버, 메타버스 스튜디오 개발자",성남 분당구,Posted10일 전,"유경험자 - 리액트 기반 개발 유경험자 [주 사용 언어] - C++, C# - Java Script - Python - Spring, React - HTML [지원 시 참고 사항] - 기술, 경험, 지식 등이 상세히 담긴..."
https://kr.indeed.com/jobs?q=python&vjk=6d86e9f32d31c84f,Data 분야 경력,서울,Posted25일 전,"해가 뛰어난 자 - R, Python, SAS, SQL 등 활용 역량 우대사항(해당 내용 중 1개 이상) - ML/DL 경험 인력 우대 - 관련 분야 석사 이상 학위 소지자 우대 - R, Python등 데이터분석 모델링 경험..."
https://kr.indeed.com/jobs?q=python&vjk=78526735d90a85b9,"Machine Learning - iOS Software Engineer,",서울,Posted30+일 전,"computer vision Python libraries... programming skills with proficiency in Python, Flask, iOS Dev tools, and GitHub..."
https://kr.indeed.com/jobs?q=python&vjk=ebd9b7e972f551fc,서버 개발자 Python(Django) Developer (신입/경력),서울 마포구,Posted30+일 전,유관직무 경력자 서버 개발자 Python(Django) Developer... 있습니다.■ 자격 요건 인터넷·IT·통신·모바일·게임>웹프로그래머> Python|인터넷·IT·통신·모바일·게임>웹프로그래머>웹개발|인터넷·IT·통신...
https://kr.indeed.com/jobs?q=python&vjk=2642a83874ea6bab,"영상처리, 컴퓨터 비전 전문가 (신입/경력)",성남 수정구,Posted30+일 전,"인원 [담당업무] Python, C++, MFC, C를 이용하여 - OpenCV 로 Visual SLAM 개발- MFC, Python을 이용하여 GUI... 통신·모바일·게임>응용프로그래머> Python|인터넷·IT·통신·모바일·게임..."
https://kr.indeed.com/jobs?q=python&vjk=834db148c2e3c7b5,[NHN Cloud] 앱가드 Android 개발,성남 판교역,Posted28일 전,"모바일 앱의 해킹 탐지 및 방어 엔진 개발 - 모바일 보안 기술 연구 - C/C++, Java, Python 언어 중 하나 이상을 이용한 개발 경력 2년 이상 - 보안 관련 지식 - 모바일 보안 솔루션 개발 경험..."
https://kr.indeed.com/jobs?q=python&vjk=cd829f275871114e,[SNOW] 렌더링 엔진 개발자,서울,Posted24일 전,"팩토링, 디자인 패턴, ReactiveX 활용 경험 - Java, Swift(Objective C), Lua, Python 등 다양한 언어 경험 - Computer Graphics 이해 - Image Processing 이해..."
https://kr.indeed.com/jobs?q=python&vjk=7fe0c284fbf4045f,CRM 및 마케팅 데이터분석 담당자 - 국내 대기업 계열사,서울,Posted30+일 전,"역량 (SQL 및 SAS, R, Python 등) - 통계 지식 보유 및... 경력자- 대용량 데이터 분석 툴 활용 역량 (SQL 및 SAS, R, Python 등)- 통계 지식 보유 및 데이터 모델링 가능자 우대- CRM 업무..."
https://kr.indeed.com/jobs?q=python&vjk=e11919aa1a40d234,Software Intern,서울,Posted24일 전,"good communication skills Good Programming Skills in C#, C, Python Understanding of attached peripherals (I2C, SPI) Basic..."
https://kr.indeed.com/jobs?q=python&vjk=1750764e7fad99ec,[키움투자자산운용] 자산배분전략팀 팀원 (사원~대리급),서울 영등포구,Posted8일 전,및 우대사항 금융·보험·증권>투자·분석·증권·외환>자산관리|인터넷·IT·통신·모바일·게임>응용프로그래머> Python|인터넷·IT·통신·모바일·게임>소프트웨어·하드웨어>소프트웨어|마케팅·광고·홍보·조사>조사·분석·통계>설문...
https://kr.indeed.com/jobs?q=python&vjk=3b7dbdf85a326a6d,국내 대기업 - AI 및 딥러닝 관련 경력자,서울,Posted30+일 전,"관련 전문 지식 있는 분 - Python 또는 Scala, JAVA 활용... 레임워크 활용 역량 좋은 분- 자연어처리 관련 전문 지식 있는 분- Python 또는 Scala, JAVA 활용 역량- 미디어/커머스/전자/IT 업계..."
https://kr.indeed.com/jobs?q=python&vjk=82d47e44be45bb97,Junior Structural Engineer,서울,Posted9일 전,"365. Structural Modeling software : Midas, Sofistik… IT language: Python (nice to have) . Job Segment: Structural Engineer..."
https://kr.indeed.com/jobs?q=python&vjk=46253fd5b203d931,"[로봇개발본부(판교근무)] 각 분야별 (백엔드, WEB APP 개발, APP 개발)",성남 분당구,Posted14일 전,게임>웹프로그래머>웹개발|인터넷·IT·통신·모바일·게임>웹프로그래머> Python|인터넷·IT·통신·모바일·게임>웹프로그래머>JAVA|인터넷·IT·통신... 통신·모바일·게임>응용프로그래머> Python|인터넷·IT·통신·모바일·게임...
https://kr.indeed.com/jobs?q=python&vjk=14d562d10c215572,"PHP, Python 신입/경력 정규직",서울 금천구,Posted30+일 전,"주식회사 비즈부스터 PHP, Python 개발자 채용 모집부문 및 자격요건 담당업무 자격요건 인원 [담당업무]*당사의 서비스(비즈탑) 솔루션 및 서비... 프로그래머>PHP |인터넷·IT·통신·모바일·게임>웹프로그래머> Python"
https://kr.indeed.com/jobs?q=python&vjk=485252a8f28fa0f8,데이터 사이언티스트 전문가,서울특별시,Posted13일 전,"개발 경험 . 자연어처리/시계열 분석/머신러닝/데이터 마이닝 알고리즘 이론 및 실무 적용에 대한 깊은 이해 . Python Data & Analytics 라이브러리 경험 (NLTK, Spacy, Scikit-Learn..."
https://kr.indeed.com/jobs?q=python&vjk=2cd08e43d8b37f87,[대기업] 클라우드 서비스 솔루션 개발,서울,Posted10일 전,C++|인터넷·IT·통신·모바일·게임>응용프로그래머>클라우드|인터넷·IT·통신·모바일·게임>응용프로그래머> Python|인터넷·IT·통신·모바일·게임>데이터베이스·DBA>데이터베이스개발자|인터넷·IT·통신·모바일·게임>데이터베...
https://kr.indeed.com/jobs?q=python&vjk=f21952a2d7a0bfd8,"[Robotics] Robotics Software Engineer, Navigation",서울,Posted30+일 전,"요역량 ㅇ 컴퓨터 공학, 로봇 공학, 전자 공학 등 관련 기술 분야 석사 이상 학위 또는 3년 이상의 경력 ㅇ Python 혹은 C++ 언어의 능숙한 활용 ㅇ ROS/ROS2 혹은 유사한 framework를 활용한 robot..."
https://kr.indeed.com/jobs?q=python&vjk=05b54a7b23b66511,2022년 2월 경력사원 (제조지능화),청주 오창읍,Posted6일 전,"경험 - 빅데이터/AI 경험(R, Python,SAS 등 분석 Tool 활용... 구축 및 거버넌스 수립 - 분석솔루션(Spotfire, SAS, R, Python) 전파 필수사항 - 관련 업무 경력 8년 이상 - 분석 시스템 구축..."
https://kr.indeed.com/jobs?q=python&vjk=025b89990231eea6,[대형증권사] 자산배분전략 수립/모델개발,서울 강남구,Posted9일 전,통신·모바일·게임>웹프로그래머>JAVA|인터넷·IT·통신·모바일·게임>웹프로그래머>프론트엔드|인터넷·IT·통신·모바일·게임>웹프로그래머> Python|인터넷·IT·통신·모바일·게임>웹프로그래머>HTML·DHTML·mHTML
https://kr.indeed.com/jobs?q=python&vjk=7fe0c284fbf4045f,CRM 및 마케팅 데이터분석 담당자 - 국내 대기업 계열사,서울,Posted30+일 전,"역량 (SQL 및 SAS, R, Python 등) - 통계 지식 보유 및... 경력자- 대용량 데이터 분석 툴 활용 역량 (SQL 및 SAS, R, Python 등)- 통계 지식 보유 및 데이터 모델링 가능자 우대- CRM 업무..."
https://kr.indeed.com/jobs?q=python&vjk=ca42174fece4f1e7,[HDC 랩스] 2022년 상반기 경력,서울특별시,Posted9일 전,"Spring, node.js, python 프레임워크를 활용한 서버 개발... 전공 무관 ㆍ총경력 : 4년 이상~8년 이하 ㆍ Python 개발 경력 4년 이상 - Python 서버 (Backend) 개발 경력 4년 이상 - 웹..."
https://kr.indeed.com/jobs?q=python&vjk=3fbf16cd38fd66c8,Software Developer & Verification,서울,Posted18일 전,"Programming Language and skillset: Java(preferred), C++, Python, CI Environment, Shell Script Native Korean and business..."
https://kr.indeed.com/jobs?q=python&vjk=a5868277027bf920,Data Engineer_Eng,서울,Posted1일 전,experience of data engineering • Proficiency in using Python or Scala • Experience in using one... followings: Batch...
https://kr.indeed.com/jobs?q=python&vjk=b79acb8f4c6b4c0d,Research Engineer,서울,Posted1일 전,"자격 요건) - 프로덕션 환경에서 발생하는 리얼 월드 문제들을 풀어 나가며 서비스와 함께 성장하고 싶으신 분 - Python 기반의 머신러닝 라이브러리를 활용한 개발에 익숙하신 분 (Tensorflow, Pytorch 등..."
https://kr.indeed.com/jobs?q=python&vjk=7585ef1908280606,데이터표준화 부문 경력,서울 강남구,Posted8일 전,"관리 2. 자격 요건 1) 필수 · Hadoop 데이터 플랫폼 사용 경험 · SQL, Spark(Scala, Python)등 데이터 처리 언어 1종 이상 숙련 · 대규모 트래픽 서비스, 대용량 배치처리 시스템의 Backend..."
https://kr.indeed.com/jobs?q=python&vjk=b9499f4d0a5a9c36,"Visual C++, Python 이용한 소프트웨어 개발 및 유지보수가 가능한 인재",용인 기흥구,Posted20일 전,"용부문 : - Visual C++, Python 을 이용한 소프트웨어 개발... 및 자격요건 담당업무 자격요건 인원 [담당업무]Visual C++, Python 을 이용한 소프트웨어 개발 및 유지보수가 가능한 인재 0명 - 계측장..."
https://kr.indeed.com/jobs?q=python&vjk=19beeb5c7f50c5b4,데이터 사이언티스트,서울,Posted7일 전,맞게 데이터 모델 및 스키마를 꾸준히 개발 및 발전 * 이런 역량을 가지신 분을 찾습니다. - SQL / Python / R 등 데이터 분석 업무를 수행할 수 있는 하나 이상의 개발 언어를 경험하신 분 - 통계 지식에 대한...
https://kr.indeed.com/jobs?q=python&vjk=474d97735565073a,[시높시스코리아] 2022년 Training & Hiring Program,서울 노원구,Posted7일 전,"수 있는 의사소통능력 우대사항 EDA Tool 개발 및 사용 경험이 있으신 분 스크립트 언어(bash, Python, TCL, Perl)를 다뤄본 경험이 있으신 분 AI & ML 분야에 관련한 깊은 경험 및 심화 지식이..."
https://kr.indeed.com/jobs?q=python&vjk=872035f47cfd4850,자산운용팀 전략/리스크팀 퀀트(겨울방학 인턴),대한민국,Posted30+일 전,공자의 경우 관련 과목 12학점 이상 이수 - Microsoft 엑셀 능숙자 선택 사항 (평가 가산점) - Python 또는 VBA 등 코딩 Skill 보유 - 관련 업종에서 2개월 이상 인턴쉽 또는 근무 경력 보유 - 관련...
https://kr.indeed.com/jobs?q=python&vjk=3b7dbdf85a326a6d,국내 대기업 - AI 및 딥러닝 관련 경력자,서울,Posted30+일 전,"관련 전문 지식 있는 분 - Python 또는 Scala, JAVA 활용... 레임워크 활용 역량 좋은 분- 자연어처리 관련 전문 지식 있는 분- Python 또는 Scala, JAVA 활용 역량- 미디어/커머스/전자/IT 업계..."
https://kr.indeed.com/jobs?q=python&vjk=9ab9e1640fdc64d5,ML Engineer_Eng,서울,Posted1일 전,"Qualifications • Experience with development using Python, Kotlin, Node.js, etc. • Experience with using RDBMS, NoSQL..."
https://kr.indeed.com/jobs?q=python&vjk=9f6ca44bd1c54a7b,2022년 2월 경력사원 (품질),청주 오창읍,Posted6일 전,"경력 - 프로그래밍 언어(R, Python, Visual Basic 등... 년 이상 - Embedded SW 개발 (C, C++) 실무 경력 - Python 활용 Big Data 분석 및 수치 해석 경험 우대사항 - BMS..."
https://kr.indeed.com/jobs?q=python&vjk=10f2dcc4001cb35f,Software Engineer - CNC (Computer Numerical Control) program...,서울,Posted5일 전,"delivery) practices Experience in multiple programming languages – Python, Javascript, C# etc Experience in TDD (Test-Driven..."
https://kr.indeed.com/jobs?q=python&vjk=cb4eca654b2c2901,[TmaxEdu/R&D] 연구 개발자,성남 분당구,Posted10일 전,"CSS, JavaScript, TypeScript [Server 개발(사용 언어)] - Java, Python, SQL [Framework(사용 언어)] - React.js, Spring [입사 지원 시 참고 사항..."
https://kr.indeed.com/jobs?q=python&vjk=b3a6c83c9debcb92,네이버 파이낸셜 플랫폼 운영,성남 삼평동,Posted30+일 전,"Docker(kubernetes) 및 어플리케이션 배포 전략 지식 보유 - Shell script, python 및 web framework 등 기타 프로그래밍 언어 활용 가능 - 국가보훈대상자 및 장애인은 법령에 의거..."
https://kr.indeed.com/jobs?q=python&vjk=b6f149c5d6b60323,"Analyst - Environmental, Social and Governance (12 months co...",서울,Posted30+일 전,"ESG) Experience and training in data analytics tools like Python, Alteryx, Tableau, Excel or other analytical platforms..."
https://kr.indeed.com/jobs?q=python&vjk=e91b5984e7f5d3fd,"데이터베이스개발자, 웹개발 신입/경력 정규직",서울 영등포구,Posted30+일 전,"개발자 ㆍCss/html 등 웹디자인 관련 유경험자 ㆍ자바스크립트, Python, C++, 닷넷 등 ㆍNode, Selenium, electron... 관련 유경험자ㆍ자바스크립트, Python, C++, 닷넷 등 ㆍNode..."
https://kr.indeed.com/jobs?q=python&vjk=79fb95da6dff4025,하반기 신입(채용 연계형 인턴) 수시채용,서울 마곡동,Posted30+일 전,"Python, R, 기타 코딩 능력 보유자 또는 통계 분석에 대한 기초 지식 보유자 중 1개 해당자 우대사항 · 통계 분석에 대한 기초 지식 보유자 · 기초 프로그래밍 코딩 구현 능력 보유자 ( Python or R..."
https://kr.indeed.com/jobs?q=python&vjk=ec5c7ccd76639120,[외국계 스타트업 미소] Data Analyst,서울,Posted30+일 전,통신·모바일·게임>빅데이터·AI(인공지능)>데이터분석|인터넷·IT·통신·모바일·게임>빅데이터·AI(인공지능)> Python|인터넷·IT·통신·모바일·게임>데이터베이스·DBA>MySQL|인터넷·IT·통신·모바일·게임>데이터베이스...
https://kr.indeed.com/jobs?q=python&vjk=4d6fa0f1b9726d7c,디지털 미디어 매니저(퍼포먼스&브랜딩) 신입/경력,서울 서초구,Posted9일 전,[우대 요건] 1) 마케팅 전공자 2) 영어 커뮤니케이션 가능자 3) Python을 통한 프로그래밍 가능자 4) 구글 및 페이스북 셀프서브 가능자 5) GA 및 써드파티 트래커 활용 가능자 마케팅·광고·홍보·조사>마케팅>온라인마케팅
https://kr.indeed.com/jobs?q=python&vjk=3cd339cf8959f44d,생명정보학 부문 박사졸 선임연구원 정규직 정규직,서울 서대문구,Posted30+일 전,"- Python or R 활용가능 -Linux terminal 능숙 -생물학... 생명정보학, 생물정보학-외국어: 영어 회화가능,독해가능,작문가능- Python or R 활용가능- Linux terminal 능숙- 생물학 기초 수강..."
